{
  "sourceId": "com.example.tools",
  "kind": "tool",
  "discoveryUrl": "https://tools.example.com/.well-known/useful-repository.json",
  "local": false,
  "trustRoot": {
    "profile": "tuf-v1",
    "rootKeyFingerprint": "9f86d081884c7d659a2feaa0c55ad015a3bf4f1b2b0b822cd15d6c15b0f00a08",
    "confirmedAt": "2026-07-20T09:00:00Z"
  },
  "capabilities": {
    "catalog": true,
    "staticMirror": true
  },
  "enabled": true,
  "priority": 100,
  "displayName": "Example Community Source",
  "operator": "Example Community"
}
